product_name,brand
PRAI AGELESS Throat & Decolletage Crème 50ml,PRAI Beauty
Neal's Yard Remedies Vitamin E and Avocado Night Cream 50g,Neal's Yard
PIXI Overnight Glow Serum,PIXI Beauty
PIXI Collagen and Retinol Serum 30ml,PIXI Beauty
PIXI Glow Tonic Serum 30ml,PIXI Beauty
Aurelia Probiotic Skincare Revitalise & Glow Serum 30ml,Aurelia
PIXI Hydrating Milky Serum 30ml,PIXI Beauty
Indeed Labs Eysilix Serum 2 15ml,Indeed Labs
The Organic Pharmacy Four Acid Peel Serum 30ml,The Organic Pharmacy
Neal's Yard Remedies Beauty Sleep Concentrate 30ml,Neal's Yard
Aurelia Skincare Firm & Replenish Body Serum 250ml,Aurelia
Indeed Labs Pepta-Bright 30ml,Indeed Labs
The Organic Pharmacy Stabilised Vitamin C Serum 30ml,The Organic Pharmacy
TanOrganic Self-Tanning Oil - Brown (100ml),TanOrganic
BBB London Luscious Lash Oil 7.5ml,BBB London
PIXI Rose Oil Blend 30ml,PIXI Beauty
PIXI Jasmine Oil Blend 30ml,PIXI Beauty
AromaWorks Rejuvenate Face Serum Oil 30ml,AromaWorks
Manuka Doctor 24K Gold & Manuka Honey Face Oil 12ml,Manuka Doctor
PIXI Glow Mist 80ml,PIXI Beauty
PIXI Hydrating Milky Mist 80ml,PIXI Beauty
PIXI Sun Mist 80ml,PIXI Beauty
Revolution Skincare Hyaluronic Essence Spray 100ml,Revolution
PIXI Vitamin Wakeup Mist 80ml,PIXI Beauty
Neal's Yard Remedies Goodnight Pillow Mist 45ml,Neal's Yard
Revolution Skincare CBD Essence Spray 100ml,Revolution
Neal's Yard Remedies Frankincense Hydrating Facial Mist 45ml,Neal's Yard
Revolution Skincare x Jake Jamie Tropical Quench Essence Spray 100ml,Revolution
Pestle & Mortar Balance Facial Spritz,Pestle & Mortar
Revolution Skincare Superfruit Essence Spray 100ml,Revolution
Bloom and Blossom Rejuvenating Facial Spritz (100ml),Bloom & Blossom
James Read Instant Bronzing Mist 200ml,James Read
ARK Skincare Hydrating Beauty Mist 150ml,ARK Skincare
BBB London Rosewater Mist 50ml,BBB London
Löwengrip Moisture on the go Facial Mist 100ml,Löwengrip
Armani Prima Mist 100ml,Armani
The Ritual of Namasté Urban Hydrating Mist 100ml,The Ritual of Namasté
PIXI Rose Flash Balm 45ml,PIXI Beauty
Spa Magik Organiks Wrinkle Therapy Moisture Melt Cleansing Balm 100ml,Spa Magik Organiks
Aurelia Probiotic Skincare Refine and Polish Miracle Balm 75ml,Aurelia
Indeed Labs Watermelon Melting Balm 100ml,Indeed Labs
Menaji Lip Balm Agent (0.15oz./4.2g),Menaji
The Ritual of Namasté Restoring Night Balm 50ml,The Ritual of Namasté
Alchimie Forever Dry Skin Balm,Alchimie Forever
APIVITA Express Moisturizing & Soothing Face Mask - Prickly Pear 2x8ml,APIVITA
PIXI PLUMP Collagen Boost Sheet Mask (Pack of 3),PIXI Beauty
Ambre Solaire After Sun Cooling Hyaluronic Acid Face Sheet Mask 32g,Ambre Solaire
APIVITA Express Intense Moisturizing Face Mask - Cucumber 2x8ml,APIVITA
APIVITA Express Moisturizing Face Mask - Sea Lavender 2x8ml,APIVITA
APIVITA Express Radiance Face Mask - Orange 2x8ml,APIVITA
APIVITA Express Detox Face Mask - Pumpkin 2x8ml,APIVITA
APIVITA Express Radiance Face Mask - Pomegranate 2x8ml,APIVITA
APIVITA Express Deep Cleansing Face Mask - Green Clay 2x8ml,APIVITA
APIVITA Express Moisturizing Face Mask - Aloe 2 x 8ml,APIVITA
APIVITA Express Firming Face Mask - Royal Jelly 2x8ml,APIVITA
PIXI Glow Mud Mask 30ml,PIXI Beauty
APIVITA Express Moisturizing Face Mask - Honey 2x8ml,APIVITA
APIVITA Express Line Reducing Face Mask - Grape 2x8ml,APIVITA
PIXI Collagen Plumping Mask 45ml,PIXI Beauty
APIVITA Moisturizing Face Mask - Aloe 50ml,APIVITA
APIVITA Deep Cleansing Face Mask - Green Clay 50ml,APIVITA
PIXI Peel and Polish,PIXI Beauty
Lancer Skincare Caviar Lime Acid Peel 50ml,Lancer
PIXI Hydrating Milky Peel 80ml,PIXI Beauty
Radical Skincare Detox Charcoal Enzyme Peel 50ml,Radical Skincare
VERSO Enzyme Peel 50ml,VERSO
Manuka Doctor ApiClear Facial Peel 100ml,Manuka Doctor
Recipe for Men Peeling Mask,Recipe for Men
PIXI Retinol Eye Cream 25ml,PIXI Beauty
Goldfaden MD Bright Eyes Dark Circle Radiance Concentrate 15ml,Goldfaden MD
Manuka Doctor ApiNourish Age-Defying Eye Cream 15ml,Manuka Doctor
REN Evercalm™ Gentle Cleansing Milk 150ml,REN
PIXI Vitamin-C Juice Cleanser 150ml,PIXI Beauty
PIXI Glow Mud Cleanser 135ml,PIXI Beauty
PIXI Makeup Melting Cleansing Cloths (40 Wipes),PIXI Beauty
Neal's Yard Remedies Rehydrating Rose Facial Wash 100ml,Neal's Yard
PIXI Glow Tonic 250ml,PIXI Beauty
PIXI Retinol Tonic 100ml,PIXI Beauty
PIXI Retinol Tonic 250ml,PIXI Beauty
PIXI Rose Tonic 100ml,PIXI Beauty
PIXI Rose Tonic 250ml,PIXI Beauty
PIXI Milky Tonic 100ml,PIXI Beauty
PIXI Milky Tonic 250ml,PIXI Beauty
Neal's Yard Remedies Rehydrating Rose Toner 200ml,Neal's Yard
The Organic Pharmacy Herbal Toner 100ml,The Organic Pharmacy
The Ritual of Namasté Clarifying Facial Toner,The Ritual of Namasté
Indeed Labs Exfoliator II 75g,Indeed Labs
MAC Mineralize Volcanic Ash Exfoliator,MAC
Löwengrip Advanced Skin Care Cell Renewal Facial Exfoliant 75ml,Löwengrip
Talika Skintelligence Hydra Face Gentle Scrub 50ml,Talika Skintelligence
Spa Magik Organiks Muscle Therapy Ache Away Eucalyptus Bath Salts,Spa Magik Organiks
L:A BRUKET No. 090 Sea Salt Bath Salt 300g,L:A BRUKET
"L:A BRUKET Marigold, Orange and Geranium Sea Salt Bath 450g",L:A BRUKET
ila-spa Bath Salts for Cleansing 500g,ila-spa
Bloom & Blossom George's Candy Floss & Marshmallow Handwash,Bloom & Blossom
REN Moroccan Rose Otto Body Wash,REN
Bloom and Blossom The Very Hungry Caterpillar Baby Hair & Body Wash 200ml,Bloom & Blossom
NEOM Tranquillity Body & Hand Wash 250ml,NEOM
L:A BRUKET No. 104 Hand & Body Wash 450ml - Bergamot/Patchouli,L:A BRUKET
L:A BRUKET No. 094 Hand & Body Wash 450ml - Sage/Rosemary/Lavender,L:A BRUKET
Elemental Herbology Neroli and Rose Damask Body Wash,Elemental
Neal's Yard Remedies Aromatic Foaming Bath 200ml,Neal's Yard
REN Moroccan Rose Otto Bath Oil,REN
Little Butterfly London Floating on Clouds Bedtime Bath Milk 250ml,Little Butterfly London